{
  "schema_version": 1,
  "id": "maestro-instructions",
  "source": "builtin",
  "instructions": [
    { "ref": "contract:handoff", "source_scope": "core", "source_paths": ["references/handoffs.md"] },
    { "ref": "policy:safety-boundary", "source_scope": "core", "source_paths": ["references/workers.md", "references/coordination.md"] },
    { "ref": "practice:requirements", "source_scope": "core", "source_paths": ["references/practices/requirements.md"] },
    { "ref": "practice:investigation", "source_scope": "core", "source_paths": ["references/practices/investigation.md"] },
    { "ref": "practice:design", "source_scope": "core", "source_paths": ["references/practices/design.md"] },
    { "ref": "practice:work-planning", "source_scope": "core", "source_paths": ["references/practices/work-planning.md"] },
    { "ref": "practice:implementation", "source_scope": "core", "source_paths": ["references/practices/implementation.md"] },
    { "ref": "practice:verification", "source_scope": "core", "source_paths": ["references/practices/verification.md"] },
    { "ref": "practice:delivery", "source_scope": "core", "source_paths": ["references/practices/delivery.md"] },
    { "ref": "practice:memory-merge", "source_scope": "core", "source_paths": ["references/practices/memory-merge.md"] },
    { "ref": "role:architect", "source_scope": "core", "source_paths": ["references/roles/architect.md"] },
    { "ref": "role:coder", "source_scope": "core", "source_paths": ["references/roles/coder.md"] },
    { "ref": "role:delivery", "source_scope": "core", "source_paths": ["references/roles/delivery.md"] },
    { "ref": "role:laborer", "source_scope": "core", "source_paths": ["references/roles/laborer.md"] },
    { "ref": "role:memory-merger", "source_scope": "core", "source_paths": ["references/roles/memory-merger.md"] },
    { "ref": "role:orchestrator", "source_scope": "core", "source_paths": ["references/roles/orchestrator.md"] },
    { "ref": "role:test-designer", "source_scope": "core", "source_paths": ["references/roles/test-designer.md"] },
    { "ref": "role:test-runner", "source_scope": "core", "source_paths": ["references/roles/test-runner.md"] },
    { "ref": "role:tpm", "source_scope": "core", "source_paths": ["references/roles/tpm.md"] }
  ]
}
